{
  "format": "pb-content/research/1",
  "categories": [
    {
      "id": "pb:aaa",
      "authored_id": "AAA",
      "name": "Alpha works",
      "folded_into": null,
      "fallback_into": null
    },
    {
      "id": "pb:bbb",
      "authored_id": "BBB",
      "name": "Beta works",
      "folded_into": null,
      "fallback_into": null
    },
    {
      "id": "pb:ccc",
      "authored_id": "CCC",
      "name": "Gamma works",
      "folded_into": null,
      "fallback_into": "pb:aaa"
    },
    {
      "id": "pb:sss",
      "authored_id": "SSS",
      "name": "Sigma works",
      "folded_into": "pb:bbb",
      "fallback_into": null
    }
  ],
  "projects": [
    {
      "id": "pb:aaa_01",
      "authored_id": "AAA-01",
      "kind": "technology",
      "name": "First alpha",
      "category": "pb:aaa",
      "year": null,
      "year_declared": "base",
      "prerequisites": [],
      "prerequisites_source": null,
      "cost_reducers": [],
      "cost_reducers_source": null,
      "effect": {
        "gate_only": true,
        "modifiers": []
      },
      "cost": [
        {
          "currency": "research",
          "amount": 100
        }
      ],
      "cost_source": "rule",
      "cost_reason": null
    },
    {
      "id": "pb:aaa_02",
      "authored_id": "AAA-02",
      "kind": "technology",
      "name": "Second alpha",
      "category": "pb:aaa",
      "year": 1931,
      "year_declared": null,
      "prerequisites": [
        [
          {
            "kind": "technology",
            "value": "pb:aaa_01"
          }
        ],
        [
          {
            "kind": "doctrine",
            "value": "pb:bbb_90"
          }
        ]
      ],
      "prerequisites_source": "AAA-01, BBB-90",
      "cost_reducers": [],
      "cost_reducers_source": null,
      "effect": {
        "gate_only": false,
        "modifiers": [
          {
            "target": "design_stat",
            "scope": "pb:tank",
            "stat": "armour_front_mm",
            "per_mille": 100
          }
        ]
      },
      "cost": [
        {
          "currency": "research",
          "amount": 100
        }
      ],
      "cost_source": "rule",
      "cost_reason": null
    },
    {
      "id": "pb:bbb_01",
      "authored_id": "BBB-01",
      "kind": "technology",
      "name": "First beta",
      "category": "pb:bbb",
      "year": 1932,
      "year_declared": null,
      "prerequisites": [
        [
          {
            "kind": "technology",
            "value": "pb:aaa_01"
          }
        ]
      ],
      "prerequisites_source": "AAA-01",
      "cost_reducers": [
        [
          {
            "kind": "flag",
            "value": "pb:test_shortage"
          }
        ]
      ],
      "cost_reducers_source": "flag:test_shortage",
      "effect": {
        "no_target": {
          "needs": "test_writer",
          "reason": "synthetic: no writer target exists for this yet"
        }
      },
      "cost": [
        {
          "currency": "research",
          "amount": 150
        }
      ],
      "cost_source": "override",
      "cost_reason": "synthetic: a deliberately dearer row"
    },
    {
      "id": "pb:sss_01",
      "authored_id": "SSS-01",
      "kind": "technology",
      "name": "First sigma",
      "category": "pb:bbb",
      "year": 1933,
      "year_declared": null,
      "prerequisites": [
        [
          {
            "kind": "technology",
            "value": "pb:aaa_02"
          },
          {
            "kind": "technology",
            "value": "pb:bbb_01"
          }
        ],
        [
          {
            "kind": "xp",
            "value": {
              "branch": "land",
              "tier": 2
            }
          }
        ]
      ],
      "prerequisites_source": "AAA-02 | BBB-01, xp:land:2",
      "cost_reducers": [],
      "cost_reducers_source": null,
      "effect": null,
      "cost": [
        {
          "currency": "research",
          "amount": 100
        }
      ],
      "cost_source": "rule",
      "cost_reason": null
    },
    {
      "id": "pb:ql_01",
      "authored_id": "QL-01",
      "kind": "doctrine",
      "name": "First drill",
      "domain": "Land",
      "branch": "Drill",
      "year": null,
      "year_declared": "base",
      "base_holders": [
        "NTH",
        "STH"
      ],
      "prerequisites": [],
      "prerequisites_source": null,
      "exclusive_with": [
        "pb:ql_02"
      ],
      "effect": {
        "gate_only": true,
        "modifiers": []
      },
      "cost": [
        {
          "currency": "doctrine",
          "amount": 80
        }
      ],
      "cost_source": "rule",
      "cost_reason": null
    },
    {
      "id": "pb:ql_02",
      "authored_id": "QL-02",
      "kind": "doctrine",
      "name": "Other drill",
      "domain": "Land",
      "branch": "Drill",
      "year": null,
      "year_declared": "base",
      "base_holders": [
        "WST",
        "EST",
        "UPL",
        "LOW",
        "MID"
      ],
      "prerequisites": [],
      "prerequisites_source": null,
      "exclusive_with": [
        "pb:ql_01"
      ],
      "effect": {
        "gate_only": true,
        "modifiers": []
      },
      "cost": [
        {
          "currency": "doctrine",
          "amount": 80
        }
      ],
      "cost_source": "rule",
      "cost_reason": null
    },
    {
      "id": "pb:bbb_90",
      "authored_id": "BBB-90",
      "kind": "doctrine",
      "name": "Doctrine with a technology-shaped id",
      "domain": "Land",
      "branch": "Drill",
      "year": null,
      "year_declared": "base",
      "base_holders": [
        "NTH",
        "STH",
        "WST",
        "EST",
        "UPL",
        "LOW",
        "MID"
      ],
      "prerequisites": [],
      "prerequisites_source": null,
      "exclusive_with": [
        "pb:ql_03"
      ],
      "effect": {
        "gate_only": true,
        "modifiers": []
      },
      "cost": [
        {
          "currency": "doctrine",
          "amount": 80
        }
      ],
      "cost_source": "rule",
      "cost_reason": null
    },
    {
      "id": "pb:ql_03",
      "authored_id": "QL-03",
      "kind": "doctrine",
      "name": "Later drill",
      "domain": "Land",
      "branch": "Drill",
      "year": 1934,
      "year_declared": null,
      "base_holders": [],
      "prerequisites": [
        [
          {
            "kind": "doctrine",
            "value": "pb:ql_01"
          }
        ],
        [
          {
            "kind": "focus",
            "value": "pb:test_plan"
          }
        ]
      ],
      "prerequisites_source": "QL-01, focus:test_plan",
      "exclusive_with": [
        "pb:bbb_90"
      ],
      "effect": null,
      "cost": [
        {
          "currency": "doctrine",
          "amount": 80
        }
      ],
      "cost_source": "rule",
      "cost_reason": null
    },
    {
      "id": "pb:design_0001",
      "kind": "design",
      "name": "Lancer Mk I (prototype B)",
      "nation": "NTH",
      "domain": "Armour",
      "role": "Light tank",
      "variant_of": null,
      "year": 1931,
      "year_declared": null,
      "acquisition": [
        [
          {
            "kind": "bureau",
            "value": "pb:de_ostwerk"
          },
          {
            "kind": "bureau",
            "value": "pb:de_kessel"
          }
        ]
      ],
      "acquisition_source": "Ostwerk | Kessel",
      "lead": "pb:de_ostwerk",
      "producers": [
        "pb:de_ostwerk_plant"
      ],
      "prerequisites": [
        [
          {
            "kind": "technology",
            "value": "pb:aaa_02"
          }
        ]
      ],
      "prerequisites_source": "AAA-02",
      "doctrine_role": [
        [
          {
            "kind": "doctrine",
            "value": "pb:ql_01"
          },
          {
            "kind": "doctrine",
            "value": "pb:ql_02"
          }
        ]
      ],
      "doctrine_role_source": "QL-01 | QL-02",
      "cost_reducers": [],
      "cost_reducers_source": null,
      "tags": [
        "DEMO"
      ],
      "cost": [
        {
          "currency": "research",
          "amount": 60
        },
        {
          "currency": "money",
          "amount": 40
        },
        {
          "currency": "steel",
          "amount": 20
        }
      ],
      "cost_source": "rule",
      "cost_reason": null
    },
    {
      "id": "pb:design_0002",
      "kind": "design",
      "name": "Lancer Mk II",
      "nation": "NTH",
      "domain": "Armour",
      "role": "Light tank",
      "variant_of": "pb:design_0001",
      "year": 1933,
      "year_declared": null,
      "acquisition": [
        [
          {
            "kind": "bureau",
            "value": "pb:de_ostwerk"
          }
        ],
        [
          {
            "kind": "bureau",
            "value": "pb:de_kessel"
          }
        ]
      ],
      "acquisition_source": "Ostwerk, Kessel",
      "lead": "pb:de_ostwerk",
      "producers": [],
      "prerequisites": [
        [
          {
            "kind": "design",
            "value": "pb:design_0001"
          }
        ]
      ],
      "prerequisites_source": "design:Lancer Mk I (prototype B)",
      "doctrine_role": [],
      "doctrine_role_source": null,
      "cost_reducers": [
        [
          {
            "kind": "fielded",
            "value": "pb:test_heavy"
          }
        ]
      ],
      "cost_reducers_source": "fielded:test_heavy",
      "tags": [],
      "cost": [
        {
          "currency": "research",
          "amount": 30
        },
        {
          "currency": "money",
          "amount": 20
        },
        {
          "currency": "steel",
          "amount": 10
        }
      ],
      "cost_source": "rule",
      "cost_reason": null
    },
    {
      "id": "pb:design_0003",
      "kind": "design",
      "name": "Kestrel 12(t)",
      "nation": "STH",
      "domain": "Aircraft",
      "role": "Fighter",